{
  "outputDir": "./out/assets",
  "publicPath": "./",
  "devServer": {
    "writeToDisk": true
  },
  "plugins": [
    [
      "build-plugin-fusion",
      {
        "themePackage": "@alifd/theme-design-pro"
      }
    ],
    [
      "build-plugin-moment-locales",
      {
        "locales": [
          "zh-cn"
        ]
      }
    ]
  ]
}
